,abstract,doi
0,Two-step quantitative real-time RT-PCR (RT-qPCR) also known as real-time RT-PCR kinetic RT-PCR or quantitative fluorescent RT-PCR has become the method of choice for gene expression analysis during the last few years. It is a fast and convenient PCR method that combines traditional RT-PCR with the phenomenon of fluorescence resonance energy transfer (FRET) using fluorogenic primers. The detection of changes in fluorescence intensity during the reaction enables the user to follow the PCR reaction in real time.RT-qPCR comprises several steps: (1) RNA is isolated from target tissue/cells; (2) mRNA is reverse-transcribed to cDNA; (3) modified gene-specific PCR primers are used to amplify a segment of the cDNA of interest following the reaction in real time; and (4) the initial concentration of the selected transcript in a specific tissue or cell type is calculated from the exponential phase of the reaction. Relative quantification or absolute quantification compared to standards that are run in parallel can be performed.This chapter describes the entire procedure from isolation of total RNA from liver and fatty tissues/cells to the use of RT-qPCR to study gene expression in these tissues. We perform relative quantification of transcripts to calculate  the fold-difference of a certain mRNA level between different samples. In addition tips for choosing primers and performing analyses are provided to help  the beginner in understanding the technique.,10.1007/978-1-60327-369-5_2
0,Circular RNAs (circRNAs) represent a large class of noncoding RNAs (ncRNAs) that  have recently emerged as regulators of gene expression. They have been shown to suppress microRNAs thereby increasing the translation and stability of the targets of such microRNAs. In this review we discuss the emerging functions of circRNAs including RNA transcription splicing turnover and translation. We also discuss other possible facets of circRNAs that can influence their function  depending on the cell context such as circRNA abundance subcellular localization interacting partners (RNA DNA and proteins) dynamic changes in interactions following stimulation and potential circRNA translation. The ensuing changes in gene expression patterns elicited by circRNAs are proposed to  drive key cellular processes such as cell proliferation differentiation and survival that govern health and disease. WIREs RNA 2017 8:e1386. doi: 10.1002/wrna.1386 For further resources related to this article please visit the WIREs website.,10.1002/wrna.1386
0,Erratum in     Nat Commun. 2015;6:7626. Cheer Joseph [Corrected to Cheer Joseph F].,10.1038/ncomms8062
0,BACKGROUND AND PURPOSE: Repeated administration of a μ opioid receptor agonist can enhance some forms of impulsivity such as delay discounting. However it is  unclear whether repeated administration alters motor impulsivity. EXPERIMENTAL APPROACH: We examined the effects of acute administration of morphine and amphetamine prior to and during daily morphine administration in rats responding under a five-choice serial reaction time task. Rats (n = 5) were  trained to detect a brief flash of light presented randomly in one of five response holes; responding in the target hole delivered food whereas responding  in the wrong hole or responding prior to illumination of the target stimulus (premature response) initiated a timeout. Premature responding served as an index of motor impulsivity. KEY RESULTS: Administered acutely morphine (0.1-10 mg·kg(-1)  i.p.) increased omissions and modestly although not significantly premature responding without  affecting response accuracy; amphetamine (0.1-1.78 mg·kg(-1)  i.p.) increased premature responding without changing omissions or response accuracy. After 3 weeks of 10 mg·kg(-1) ·day(-1) morphine tolerance developed to its effects on  omissions whereas premature responding increased approximately fourfold compared with baseline. Effects of amphetamine were not significantly affected by daily morphine administration. CONCLUSIONS AND IMPLICATIONS: These data suggest that repeated administration of  morphine increased effects of morphine on motor impulsivity although tolerance developed to other effects such as omissions. To the extent that impulsivity is  a risk factor for drug abuse repeated administration of μ opioid receptor agonists for recreational or therapeutic purposes might increase impulsivity and thus the risk for drug abuse.,10.1111/bph.13434
0,Individuals from different populations vary considerably in their susceptibility  to immune-related diseases. To understand how genetic variation and natural selection contribute to these differences we tested for the effects of African versus European ancestry on the transcriptional response of primary macrophages to live bacterial pathogens. A total of 9.3% of macrophage-expressed genes show ancestry-associated differences in the gene regulatory response to infection and African ancestry specifically predicts a stronger inflammatory response and reduced intracellular bacterial growth. A large proportion of these differences are under genetic control: for 804 genes more than 75% of ancestry effects on the immune response can be explained by a single cis- or trans-acting expression  quantitative trait locus (eQTL). Finally we show that genetic effects on the immune response are strongly enriched for recent population-specific signatures  of adaptation. Together our results demonstrate how historical selective events  continue to shape human phenotypic diversity today including for traits that are key to controlling infection.,10.1016/j.cell.2016.09.025
0,The functional rules for microRNA (miRNA) targeting remain controversial despite  their biological importance because only a small fraction of distinct interactions called site types have been examined among an astronomical number  of site types that can occur between miRNAs and their target mRNAs. To systematically discover functional site types and to evaluate the contradicting rules reported previously we used large-scale transcriptome data and statistically examined whether each of approximately 2 billion site types is enriched in differentially downregulated mRNAs responding to overexpressed miRNAs. Accordingly we identified seven non-canonical functional site types most of which are novel in addition to four canonical site types while also removing numerous false positives reported by previous studies. Extensive experimental validation and significantly elevated 3' UTR sequence conservation indicate that these non-canonical site types may have biologically relevant roles. Our expanded catalog of functional site types suggests that the gene regulatory network controlled by miRNAs may be far more complex than currently understood.,10.1038/ng.3694
0,"Histone-modifying enzymes regulate transcription and are sensitive to availability of endogenous small-molecule metabolites allowing chromatin to respond to changes in environment. The gut microbiota produces a myriad of metabolites that affect host physiology and susceptibility to disease; however the underlying molecular events remain largely unknown. Here we demonstrate that  microbial colonization regulates global histone acetylation and methylation in multiple host tissues in a diet-dependent manner: consumption of a ""Western-type"" diet prevents many of the microbiota-dependent chromatin changes that occur in a  polysaccharide-rich diet. Finally we demonstrate that supplementation of germ-free mice with short-chain fatty acids major products of gut bacterial fermentation is sufficient to recapitulate chromatin modification states and transcriptional responses associated with colonization. These findings have profound implications for understanding the complex functional interactions between diet gut microbiota and host health.",10.1016/j.molcel.2016.10.025
0,Systemic arterial hypertension is an important cause of cardiovascular disease morbidity and mortality. African Americans are disproportionately affected by hypertension in fact the incidence prevalence and severity of hypertension is  highest among African American (AA) women. Previous data suggests that differential gene expression influences individual susceptibility to selected diseases and we hypothesized that this phenomena may affect health disparities in hypertension. Transcriptional profiling of peripheral blood mononuclear cells from AA or white normotensive or hypertensive females identified thousands of mRNAs differentially-expressed by race and/or hypertension. Predominant gene expression differences were observed in AA hypertensive females compared to AA normotensives or white hypertensives. Since microRNAs play important roles in regulating gene expression we profiled global microRNA expression and observed differentially-expressed microRNAs by race and/or hypertension. We identified novel mRNA-microRNA pairs potentially involved in hypertension-related pathways and differently-expressed including MCL1/miR-20a-5p APOL3/miR-4763-5p PLD1/miR-4717-3p and PLD1/miR-4709-3p. We validated gene expression levels via RT-qPCR and microRNA target validation was performed in primary endothelial cells. Altogether we identified significant gene expression differences between  AA and white female hypertensives and pinpointed novel mRNA-microRNA pairs differentially-expressed by hypertension and race. These differences may contribute to the known disparities in hypertension and may be potential targets  for intervention.,10.1038/srep35815
0,"PURPOSE: African Americans (AA) exhibit higher rates of prostate cancer incidence and mortality compared with European American (EA) men. In addition to socioeconomic influences biologic factors are believed to play a critical role in prostate cancer disparities. We investigated whether population-specific and -enriched miRNA-mRNA interactions might contribute to prostate cancer disparities. EXPERIMENTAL DESIGN: Integrative genomics was used combining miRNA and mRNA profiling miRNA target prediction pathway analysis and functional validation  to map miRNA-mRNA interactions associated with prostate cancer disparities. RESULTS: We identified 22 AA-specific and 18 EA-specific miRNAs in prostate cancer versus patient-matched normal prostate and 10 ""AA-enriched/-depleted"" miRNAs in AA prostate cancer versus EA prostate cancer comparisons. Many of these population-specific/-enriched miRNAs could be paired with target mRNAs that exhibited an inverse pattern of differential expression. Pathway analysis revealed EGFR (or ERBB) signaling as a critical pathway significantly regulated by AA-specific/-enriched mRNAs and miRNA-mRNA pairings. Novel miRNA-mRNA pairings were validated by qRT-PCR Western blot and/or IHC analyses in prostate cancer specimens. Loss/gain of function assays performed in population-specific prostate cancer cell lines confirmed miR-133a/MCL1 miR-513c/STAT1 miR-96/FOXO3A miR-145/ITPR2 and miR-34a/PPP2R2A as critical miRNA-mRNA pairings driving oncogenesis. Manipulating the balance of these pairings resulted in decreased proliferation and invasion and enhanced sensitization to docetaxel-induced cytotoxicity in AA prostate cancer cells. CONCLUSIONS: Our data suggest that AA-specific/-enriched miRNA-mRNA pairings may  play a critical role in the activation of oncogenic pathways in AA prostate cancer. Our findings also suggest that miR-133a/MCL1 miR-513c/STAT1 and miR-96/FOXO3A may have clinical significance in the development of novel strategies for treating aggressive prostate cancer.",10.1158/1078-0432.ccr-14-1566
0,Hyperglycemia and hypertension impair endothelial function in part through oxidative stress-activated poly (ADP-ribose) polymerase 1 (PARP1). Biguanides and angiotensin II receptor blockers (ARBs) such as metformin and telmisartan have a  vascular protective effect. We used cultured vascular endothelial cells (ECs) diabetic and hypertensive rodent models and AMPKα2-knockout mice to investigate  whether metformin and telmisartan have a beneficial effect on the endothelium via AMP-activated protein kinase (AMPK) phosphorylation of PARP1 and thus inhibition  of PARP1 activity. The results showed that metformin and telmisartan but not glipizide and metoprolol activated AMPK which phosphorylated PARP1 Ser-177 in cultured ECs and the vascular wall of rodent models. Experiments using phosphorylated/de-phosphorylated PARP1 mutants show that AMPK phosphorylation of  PARP1 leads to decreased PARP1 activity and attenuated protein poly(ADP-ribosyl)ation (PARylation) but increased endothelial nitric oxide synthase (eNOS) activity and silent mating type information regulation 2 homolog  1 (SIRT1) expression. Taken together the data presented here suggest biguanides  and ARBs have a beneficial effect on the vasculature by the cascade of AMPK phosphorylation of PARP1 to inhibit PARP1 activity and protein PARylation in ECs thereby mitigating endothelial dysfunction.,10.1371/journal.pone.0151845
0,The study of human consciousness has historically depended on introspection. However introspection is constrained by what can be remembered and verbalized. Here we demonstrate the utility of high temporal resolution pupillometry to track the locus of conscious attention dynamically over a single trial. While eye-tracked participants heard several musical clips played diotically (same music in each ear) and later dichotically (two clips played simultaneously one in each ear). During dichotic presentation participants attended to only one ear. We found that the temporal pattern of pupil dilation dynamics over a single  trial discriminated which piece of music was consciously attended on dichotic trials. Deconvolving these pupillary responses further revealed the real-time changes in stimulus salience motivating pupil dilation. Taken together these results show that pupil dilation patterns during single-exposure to dynamic stimuli can be exploited to discern the contents of conscious attention.,10.1016/j.concog.2015.05.001
0,The present study demonstrates that humans' response to a single stimulus (S1) is determined by what follows S1's associates. The experiment used a sensory preconditioning (SPC) design where S1 was associated with both S2 and S3 on separate trials before establishing relationships between these latter stimuli with an outcome or its absence in a second phase. When S2 and S3 were associated  with the same consequence either an outcome or its absence strong consequence-based responding to S1 was observed in a reaction time test. Participants responded quickly to indicate that the outcome was or was not predicted by S1. When S2 predicted the outcome and S3 did not SPC was weaker although participants were not slower to respond to S1. Implications on the understanding of the mechanisms that allow for the response to S1 to emerge are discussed.,10.1016/j.beproc.2014.09.034
0,Dopamine neurons are thought to signal reward prediction error or the difference between actual and predicted reward. How dopamine neurons jointly encode this information however remains unclear. One possibility is that different neurons  specialize in different aspects of prediction error; another is that each neuron  calculates prediction error in the same way. We recorded from optogenetically identified dopamine neurons in the lateral ventral tegmental area (VTA) while mice performed classical conditioning tasks. Our tasks allowed us to determine the full prediction error functions of dopamine neurons and compare them to each  other. We found marked homogeneity among individual dopamine neurons: their responses to both unexpected and expected rewards followed the same function just scaled up or down. As a result we were able to describe both individual and population responses using just two parameters. Such uniformity ensures robust information coding allowing each dopamine neuron to contribute fully to the prediction error signal.,10.1038/nn.4239
0,Hippocampal replay during sharp-wave ripple events (SWRs) is thought to drive memory consolidation in hippocampal and cortical circuits. Changes in neocortical activity can precede SWR events but whether and how these changes influence the  content of replay remains unknown. Here we show that during sleep there is a rapid cortical-hippocampal-cortical loop of information flow around the times of  SWRs. We recorded neural activity in auditory cortex (AC) and hippocampus of rats as they learned a sound-guided task and during sleep. We found that patterned activation in AC precedes and predicts the subsequent content of hippocampal activity during SWRs while hippocampal patterns during SWRs predict subsequent AC activity. Delivering sounds during sleep biased AC activity patterns and sound-biased AC patterns predicted subsequent hippocampal activity. These findings suggest that activation of specific cortical representations during sleep influences the identity of the memories that are consolidated into long-term stores.,10.1038/nn.4457
0,Encoding of behavioral episodes as spike sequences during hippocampal theta oscillations provides a neural substrate for computations on events extended across time and space. However the mechanisms underlying the numerous and diverse experimentally observed properties of theta sequences remain poorly understood. Here we account for theta sequences using a novel model constrained by the septo-hippocampal circuitry. We show that when spontaneously active interneurons integrate spatial signals and theta frequency pacemaker inputs they generate phase precessing action potentials that can coordinate theta sequences in place cell populations. We reveal novel constraints on sequence generation predict cellular properties and neural dynamics that characterize sequence compression identify circuit organization principles for high capacity sequential representation and show that theta sequences can be used as substrates for association of conditioned stimuli with recent and upcoming events. Our results suggest mechanisms for flexible sequence compression that are suited to associative learning across an animal's lifespan.,10.7554/elife.20349
0,Changes in gamma oscillations (20-50 Hz) have been observed in several neurological disorders. However the relationship between gamma oscillations and  cellular pathologies is unclear. Here we show reduced behaviourally driven gamma oscillations before the onset of plaque formation or cognitive decline in a mouse model of Alzheimer's disease. Optogenetically driving fast-spiking parvalbumin-positive (FS-PV)-interneurons at gamma (40 Hz) but not other frequencies reduces levels of amyloid-β (Aβ)1-40 and Aβ 1-42 isoforms. Gene expression profiling revealed induction of genes associated with morphological transformation of microglia and histological analysis confirmed increased microglia co-localization with Aβ. Subsequently we designed a non-invasive 40 Hz light-flickering regime that reduced Aβ1-40 and Aβ1-42 levels in the visual cortex of pre-depositing mice and mitigated plaque load in aged depositing mice. Our findings uncover a previously unappreciated function of gamma rhythms in recruiting both neuronal and glial responses to attenuate Alzheimer's-disease-associated pathology.,10.1038/nature20587
0,Imagining future events conveys adaptive benefits yet recurrent simulations of feared situations may help to maintain anxiety. In two studies we tested the hypothesis that people can attenuate future fears by suppressing anticipatory simulations of dreaded events. Participants repeatedly imagined upsetting episodes that they feared might happen to them and suppressed imaginings of other such events. Suppressing imagination engaged the right dorsolateral prefrontal cortex which modulated activation in the hippocampus and in the ventromedial prefrontal cortex (vmPFC). Consistent with the role of the vmPFC in providing access to details that are typical for an event stronger inhibition of this region was associated with greater forgetting of such details. Suppression further hindered participants' ability to later freely envision suppressed episodes. Critically it also reduced feelings of apprehensiveness about the feared scenario and individuals who were particularly successful at down-regulating fears were also less trait-anxious. Attenuating apprehensiveness  by suppressing simulations of feared events may thus be an effective coping strategy suggesting that a deficiency in this mechanism could contribute to the  development of anxiety.,10.1073/pnas.1606604114
0,"The hippocampus has been implicated in integrating information across separate events in support of mnemonic generalizations. These generalizations may be underpinned by processes at both encoding (linking similar information across events) and retrieval (""on-the-fly"" generalization). However the relative contribution of the hippocampus to encoding- and retrieval-based generalizations  is poorly understood. Using fMRI in humans we investigated the hippocampal role  in gradually learning a set of spatial discriminations and subsequently generalizing them in an acquired equivalence task. We found a highly significant  correlation between individuals' performance on a generalization test and hippocampal activity during the test providing evidence that hippocampal processes support on-the-fly generalizations at retrieval. Within the same hippocampal region there was also a correlation between activity during the final stage of learning (when all associations had been learnt but no generalization was required) and subsequent generalization performance. We suggest that the hippocampus spontaneously retrieves prior events that share overlapping features  with the current event. This process may also support the creation of generalized representations during encoding. These findings are supportive of the view that the hippocampus contributes to both encoding- and retrieval-based generalization  via the same basic mechanism; retrieval of similar events sharing common features. © 2016 The Authors Hippocampus Published by Wiley Periodicals Inc.",10.1002/hipo.22688
0,In addition to dopamine neurons the ventral tegmental area (VTA) contains GABA- glutamate- and co-releasing neurons and recent reports suggest a complex role for the glutamate neurons in behavioural reinforcement. We report that optogenetic stimulation of VTA glutamate neurons or terminals serves as a positive reinforcer on operant behavioural assays. Mice display marked preference for brief over sustained VTA glutamate neuron stimulation resulting in behavioural responses that are notably distinct from dopamine neuron stimulation  and resistant to dopamine receptor antagonists. Whole-cell recordings reveal EPSCs following stimulation of VTA glutamate terminals in the nucleus accumbens or local VTA collaterals; but reveal both excitatory and monosynaptic inhibitory  currents in the ventral pallidum and lateral habenula though the net effects on  postsynaptic firing in each region are consistent with the observed rewarding behavioural effects. These data indicate that VTA glutamate neurons co-release GABA in a projection-target-dependent manner and that their transient activation  drives positive reinforcement.,10.1038/ncomms13697
0,"Peripheral sensory organs provide the first transformation of sensory information and understanding how their physical embodiment shapes transduction  is central to understanding perception. We report the characterization of surface transduction during active sensing in the rodent vibrissa sensory system a widely used model. Employing high-speed videography we tracked vibrissae while rats sampled rough and smooth textures. Variation in vibrissa length predicted motion mean frequencies including for the highest velocity events indicating that biomechanics such as vibrissa resonance shape signals most likely to drive neural activity. Rough surface contact generated large amplitude high-velocity ""stick-slip-ring"" events while smooth surfaces generated smaller and more regular stick-slip oscillations. Both surfaces produced velocities exceeding those applied in reduced preparations indicating active sensation of surfaces generates more robust drive than previously predicted. These findings demonstrate a key role for embodiment in vibrissal sensing and the importance of input transformations in sensory representation.",10.1016/j.neuron.2007.12.024
0,Mural cells (vascular smooth muscle cells and pericytes) play an essential role in the development of the vasculature promoting vascular quiescence and long-term vessel stabilization through their interactions with endothelial cells. However the mechanistic details of how mural cells stabilize vessels are not fully understood. We have examined the emergence and functional role of mural cells investing the dorsal aorta during early development using the zebrafish. Consistent with previous literature our data suggest that cells ensheathing the  dorsal aorta emerge from a sub-population of cells in the adjacent sclerotome. Inhibition of mural cell recruitment to the dorsal aorta through disruption of pdgfr signaling leads to a reduced vascular basement membrane which in turn results in enhanced dorsal aorta vessel elasticity and failure to restrict aortic diameter. Our results provide direct in vivo evidence for a functional role for mural cells in patterning and stabilization of the early vasculature through production and maintenance of the vascular basement membrane to prevent abnormal  aortic expansion and elasticity.,10.1242/dev.143131
