,abstract,doi
0,The ability to find one's way depends on neural algorithms that integrate information about place distance and direction but the implementation of these  operations in cortical microcircuits is poorly understood. Here we show that the  dorsocaudal medial entorhinal cortex (dMEC) contains a directionally oriented topographically organized neural map of the spatial environment. Its key unit is  the 'grid cell' which is activated whenever the animal's position coincides with any vertex of a regular grid of equilateral triangles spanning the surface of the environment. Grids of neighbouring cells share a common orientation and spacing  but their vertex locations (their phases) differ. The spacing and size of individual fields increase from dorsal to ventral dMEC. The map is anchored to external landmarks but persists in their absence suggesting that grid cells may be part of a generalized path-integration-based map of the spatial environment.,10.1038/nature03721
0,Hippocampal information processing is discretized by oscillations and the ensemble activity of place cells is organized into temporal sequences bounded by  theta cycles. Theta sequences represent time-compressed trajectories through space. Their forward-directed nature makes them an intuitive candidate mechanism  for planning future trajectories but their connection to goal-directed behavior  remains unclear. As rats performed a value-guided decision-making task the extent to which theta sequences projected ahead of the animal's current location  varied on a moment-by-moment basis depending on the rat's goals. Look-ahead extended farther on journeys to distant goals than on journeys to more proximal goals and was predictive of the animal's destination. On arrival at goals however look-ahead was similar regardless of where the animal began its journey  from. Together these results provide evidence that hippocampal theta sequences contain information related to goals or intentions pointing toward a potential spatial basis for planning.,10.1038/nn.3909
0,Different olfactory cortical regions are thought to harbor distinct sensory representations enabling each area to play a unique role in odor perception and  behavior. In the piriform cortex (PCx) spatially dispersed sensory inputs evoke  activity in distributed ensembles of neurons that act as substrates for odor learning. In contrast the posterolateral cortical amygdala (plCoA) receives hardwired inputs that may link specific odor cues to innate olfactory behaviors.  Here we show that despite stark differences in the patterning of plCoA and PCx inputs odor-evoked neural ensembles in both areas are equally capable of discriminating odors and exhibit similar odor tuning reliability and correlation structure. These results demonstrate that brain regions mediating odor-driven innate behaviors can like brain areas involved in odor learning represent odor objects using distributive population codes; these findings suggest both alternative mechanisms for the generation of innate odor-driven behaviors and additional roles for the plCoA in odor perception.,10.1016/j.neuron.2017.02.010
0,Many complex spike cells in the hippocampus of the freely moving rat have as their primary correlate the animal's location in an environment (place cells). In contrast the hippocampal electroencephalograph theta pattern of rhythmical waves (7-12 Hz) is better correlated with a class of movements that change the rat's location in an environment. During movement through the place field the complex  spike cells often fire in a bursting pattern with an interburst frequency in the  same range as the concurrent electroencephalograph theta. The present study examined the phase of the theta wave at which the place cells fired. It was found that firing consistently began at a particular phase as the rat entered the field but then shifted in a systematic way during traversal of the field moving progressively forward on each theta cycle. This precession of the phase ranged from 100 degrees to 355 degrees in different cells. The effect appeared to be due to the fact that individual cells had a higher interburst rate than the theta frequency. The phase was highly correlated with spatial location and less well correlated with temporal aspects of behavior such as the time after place field  entry. These results have implications for several aspects of hippocampal function. First by using the phase relationship as well as the firing rate place cells can improve the accuracy of place coding. Second the characteristics of the phase shift constrain the models that define the construction of place fields. Third the results restrict the temporal and spatial circumstances under  which synapses in the hippocampus could be modified.,10.1002/hipo.450030307
0,For reliable stimulus identification sensory codes have to be robust by including redundancy to combat noise but redundancy sacrifices coding efficiency. To address how experience affects the balance between the robustness  and efficiency of sensory codes we probed odor representations in the mouse olfactory bulb during learning over a week using longitudinal two-photon calcium imaging. When mice learned to discriminate between two dissimilar odorants responses of mitral cell ensembles to the two odorants gradually became less discrete increasing the efficiency. In contrast when mice learned to discriminate between two very similar odorants the initially overlapping representations of the two odorants became progressively decorrelated enhancing  the robustness. Qualitatively similar changes were observed when the same odorants were experienced passively a condition that would induce implicit perceptual learning. These results suggest that experience adjusts odor representations to balance the robustness and efficiency depending on the similarity of the experienced odorants.,10.1016/j.neuron.2016.09.004
0,The motivation to seek social contact may arise from either positive or negative  emotional states as social interaction can be rewarding and social isolation can be aversive. While ventral tegmental area (VTA) dopamine (DA) neurons may mediate social reward a cellular substrate for the negative affective state of loneliness has remained elusive. Here we identify a functional role for DA neurons in the dorsal raphe nucleus (DRN) in which we observe synaptic changes following acute social isolation. DRN DA neurons show increased activity upon social contact following isolation revealed by in vivo calcium imaging. Optogenetic activation of DRN DA neurons increases social preference but causes place avoidance. Furthermore these neurons are necessary for promoting rebound sociability following an acute period of isolation. Finally the degree to which  these neurons modulate behavior is predicted by social rank together supporting  a role for DRN dopamine neurons in mediating a loneliness-like state. PAPERCLIP.,10.1016/j.cell.2015.12.040
0,,10.1016/s0306-4522(97)00049-3
0,Cognitive inhibitory control the ability to rapidly suppress responses inappropriate for the context is essential for flexible and adaptive behavior. Although most studies on inhibitory control have focused on the fronto-basal-ganglia circuit we found that rapid behavioral stopping is enabled  by neuronal inhibition in the basal forebrain (BF). In rats performing the stop signal task putative noncholinergic BF neurons with phasic bursting responses to the go signal were nearly completely inhibited by the stop signal. The onset of BF neuronal inhibition was tightly coupled with and temporally preceded the latency to stop the stop signal reaction time. Artificial inhibition of BF activity in the absence of the stop signal was sufficient to reproduce rapid behavioral stopping. These results reveal a previously unknown subcortical mechanism of rapid inhibitory control by the BF which provides bidirectional control over the speed of response generation and inhibition.,10.1038/nn.4110
0,Most glial cells show pronounced migratory abilities and generally follow axonal  trajectories to reach their final destination. However the molecular cues controlling their directional migration are largely unknown. To address this we  established glial migration onto the developing Drosophila leg imaginal disc as a model. Here CNS-derived glial cells move along nerves containing motoaxons and sensory axons. Along their path glial cells encounter at least three choice points where directional decisions are needed. Subsequent genetic analyses allowed uncovering mechanisms that escaped previous studies. Most strikingly we  found that glial cells require the expression of the repulsive guidance receptors PlexinA/B and Robo2 to prevent breaking away from the nerve. Interestingly the repulsive ligands are presented by the underlying leg imaginal disc epithelium which appears to push glial cells toward the axon fascicle. In conclusion nerve  formation not only requires neuron-glia interaction but also depends on glial-epithelial communication.,10.1016/j.devcel.2016.11.016
0,,10.1016/0006-8993(71)90358-1
0,Neurons can produce action potentials with high temporal precision. A fundamental issue is whether and how this capability is used in information processing. According to the 'cell assembly' hypothesis transient synchrony of anatomically  distributed groups of neurons underlies processing of both external sensory input and internal cognitive mechanisms. Accordingly neuron populations should be arranged into groups whose synchrony exceeds that predicted by common modulation  by sensory input. Here we find that the spike times of hippocampal pyramidal cells can be predicted more accurately by using the spike times of simultaneously recorded neurons in addition to the animals location in space. This improvement remained when the spatial prediction was refined with a spatially dependent theta phase modulation. The time window in which spike times are best predicted from simultaneous peer activity is 10-30 ms suggesting that cell assemblies are synchronized at this timescale. Because this temporal window matches the membrane time constant of pyramidal neurons the period of the hippocampal gamma oscillation and the time window for synaptic plasticity we propose that cooperative activity at this timescale is optimal for information transmission and storage in cortical circuits.,10.1038/nature01834
0,There is a popular belief in neuroscience that we are primarily data limited and that producing large multimodal and complex datasets will with the help of advanced data analysis algorithms lead to fundamental insights into the way the  brain processes information. These datasets do not yet exist and if they did we  would have no way of evaluating whether or not the algorithmically-generated insights were sufficient or even correct. To address this here we take a classical microprocessor as a model organism and use our ability to perform arbitrary experiments on it to see if popular data analysis methods from neuroscience can elucidate the way it processes information. Microprocessors are  among those artificial information processing systems that are both complex and that we understand at all levels from the overall logical flow via logical gates to the dynamics of transistors. We show that the approaches reveal interesting structure in the data but do not meaningfully describe the hierarchy  of information processing in the microprocessor. This suggests current analytic approaches in neuroscience may fall short of producing meaningful understanding of neural systems regardless of the amount of data. Additionally we argue for scientists using complex non-linear dynamical systems with known ground truth such as the microprocessor as a validation platform for time-series and structure discovery methods.,10.1371/journal.pcbi.1005268
0,How long does it take for the human visual system to process a complex natural image? Subjectively recognition of familiar objects and scenes appears to be virtually instantaneous but measuring this processing time experimentally has proved difficult. Behavioural measures such as reaction times can be used but these include not only visual processing but also the time required for response  execution. However event-related potentials (ERPs) can sometimes reveal signs of neural processing well before the motor output. Here we use a go/no-go categorization task in which subjects have to decide whether a previously unseen  photograph flashed on for just 20 ms contains an animal. ERP analysis revealed  a frontal negativity specific to no-go trials that develops roughly 150 ms after  stimulus onset. We conclude that the visual processing needed to perform this highly demanding task can be achieved in under 150 ms.,10.1038/381520a0
0,In the vast majority of brain areas the firing rates of neurons averaged over several hundred milliseconds to several seconds can be strongly modulated by and provide accurate information about properties of their inputs. This is referred to as the rate code. However the biophysical laws of synaptic plasticity require precise timing of spikes over short timescales (<10 ms). Hence it is critical to understand the physiological mechanisms that can generate precise spike timing in vivo and the relationship between such a temporal code and a rate code. Here we propose a mechanism by which a temporal code can be generated through an interaction between an asymmetric rate code and oscillatory  inhibition. Consistent with the predictions of our model the rate and temporal codes of hippocampal pyramidal neurons are highly correlated. Furthermore the temporal code becomes more robust with experience. The resulting spike timing satisfies the temporal order constraints of hebbian learning. Thus oscillations  and receptive field asymmetry may have a critical role in temporal sequence learning.,10.1038/nature00807
0,When spinal circuits generate rhythmic movements it is important that the neuronal activity remains within stable bounds to avoid saturation and to preserve responsiveness. Here we simultaneously record from hundreds of neurons  in lumbar spinal circuits of turtles and establish the neuronal fraction that operates within either a 'mean-driven' or a 'fluctuation-driven' regime. Fluctuation-driven neurons have a 'supralinear' input-output curve which enhances sensitivity whereas the mean-driven regime reduces sensitivity. We find a rich diversity of firing rates across the neuronal population as reflected in a lognormal distribution and demonstrate that half of the neurons spend at least 50 % of the time in the 'fluctuation-driven' regime regardless of behavior. Because  of the disparity in input-output properties for these two regimes this fraction  may reflect a fine trade-off between stability and sensitivity in order to maintain flexibility across behaviors.,10.7554/elife.18805
0,The basal ganglia have been shown to contribute to habit and stimulus-response (S-R) learning. These forms of learning have the property of slow acquisition and in humans can occur without conscious awareness. This paper proposes that one aspect of basal ganglia-based learning is the recoding of cortically derived  information within the striatum. Modular corticostriatal projection patterns demonstrated experimentally are viewed as producing recoded templates suitable for the gradual selection of new input-output relations in cortico-basal ganglia  loops. Recordings from striatal projection neurons and interneurons show that activity patterns in the striatum are modified gradually during the course of S-R learning. It is proposed that this recoding within the striatum can chunk the representations of motor and cognitive action sequences so that they can be implemented as performance units. This scheme generalizes Miller's notion of information chunking to action control. The formation and the efficient implementation of action chunks are viewed as being based on predictive signals.  It is suggested that information chunking provides a mechanism for the acquisition and the expression of action repertoires that without such information compression would be biologically unwieldy or difficult to implement. The learning and memory functions of the basal ganglia are thus seen as core features of the basal ganglia's influence on motor and cognitive pattern generators.,10.1006/nlme.1998.3843
0,How the brain selects appropriate sensory inputs and suppresses distractors is unknown. Given the well-established role of the prefrontal cortex (PFC) in executive function its interactions with sensory cortical areas during attention have been hypothesized to control sensory selection. To test this idea and more  generally dissect the circuits underlying sensory selection we developed a cross-modal divided-attention task in mice that allowed genetic access to this cognitive process. By optogenetically perturbing PFC function in a temporally precise window the ability of mice to select appropriately between conflicting visual and auditory stimuli was diminished. Equivalent sensory thalamocortical manipulations showed that behaviour was causally dependent on PFC interactions with the sensory thalamus not sensory cortex. Consistent with this notion we found neurons of the visual thalamic reticular nucleus (visTRN) to exhibit PFC-dependent changes in firing rate predictive of the modality selected. visTRN  activity was causal to performance as confirmed by bidirectional optogenetic manipulations of this subnetwork. Using a combination of electrophysiology and intracellular chloride photometry we demonstrated that visTRN dynamically controls visual thalamic gain through feedforward inhibition. Our experiments introduce a new subcortical model of sensory selection in which the PFC biases thalamic reticular subnetworks to control thalamic sensory gain selecting appropriate inputs for further processing.,10.1038/nature15398
0,Cortical activity involves large populations of neurons even when it is limited  to functionally coherent areas. Electrophysiological recordings on the other hand involve comparatively small neural ensembles even when modern-day techniques are used. Here we review results which have started to fill the gap between these two scales of inquiry by shedding light on the statistical distributions of activity in large populations of cells. We put our main focus on data recorded in awake animals that perform simple decision-making tasks and consider statistical distributions of activity throughout cortex across sensory associative and motor areas. We transversally review the complexity of these distributions from distributions of firing rates and metrics of spike-train structure through distributions of tuning to stimuli or actions and of choice signals and finally the dynamical evolution of neural population activity and the distributions of (pairwise) neural interactions. This approach reveals shared patterns of statistical organization across cortex including: (i) long-tailed distributions of activity where quasi-silence seems to be the rule for a majority of neurons; that are barely distinguishable between spontaneous and active states; (ii) distributions of tuning parameters for sensory (and motor) variables which show an extensive extrapolation and fragmentation of their representations in the periphery; and (iii) population-wide dynamics that reveal  rotations of internal representations over time whose traces can be found both in stimulus-driven and internally generated activity. We discuss how these insights are leading us away from the notion of discrete classes of cells and are acting as powerful constraints on theories and models of cortical organization and population coding.,10.1016/j.pneurobio.2012.09.004
0,Slow-wave sleep (SWS) is important for memory consolidation. During sleep neural patterns reflecting previously acquired information are replayed. One possible reason for this is that such replay exchanges information between hippocampus and neocortex supporting consolidation. We recorded neuron ensembles in the rat medial prefrontal cortex (mPFC) to study memory trace reactivation during SWS following learning and execution of cross-modal strategy shifts. In general reactivation of learning-related patterns occurred in distinct highly synchronized transient bouts mostly simultaneous with hippocampal sharp wave/ripple complexes (SPWRs) when hippocampal ensemble reactivation and cortico-hippocampal interaction is enhanced. During sleep following learning of a new rule mPFC neural patterns that appeared during response selection replayed prominently coincident with hippocampal SPWRs. This was learning dependent as the patterns appeared only after rule acquisition. Therefore learning or the resulting reliable reward influenced which patterns were most strongly encoded and successively reactivated in the hippocampal/prefrontal network.,10.1038/nn.2337
0,,10.1113/jphysiol.1962.sp006837
0,Intelligent behavior demands not only multiple forms of spatial representation but also coordination among the brain regions mediating those representations. Retrosplenial cortex is densely interconnected with the majority of cortical and  subcortical brain structures that register an animal's position in multiple internal and external spatial frames of reference. This unique anatomy suggests that it functions to integrate distinct forms of spatial information and provides an interface for transformations between them. Evidence for this was found in rats traversing two different routes placed at different environmental locations. Retrosplenial ensembles robustly encoded conjunctions of progress through the current route position in the larger environment and the left versus right turning behavior of the animal. Thus the retrosplenial cortex has the requisite  dynamics to serve as an intermediary between brain regions generating different forms of spatial mapping a result that is consistent with navigational and episodic memory impairments following damage to this region in humans.,10.1038/nn.4058
0,Theoretical models have long pointed to the dentate gyrus as a possible source of neuronal pattern separation. In agreement with predictions from these models we  show that minimal changes in the shape of the environment in which rats are exploring can substantially alter correlated activity patterns among place-modulated granule cells in the dentate gyrus. When the environments are made more different new cell populations are recruited in CA3 but not in the dentate gyrus. These results imply a dual mechanism for pattern separation in which signals from the entorhinal cortex can be decorrelated both by changes in coincidence patterns in the dentate gyrus and by recruitment of nonoverlapping cell assemblies in CA3.,10.1126/science.1135801
0,Episodic memories initially require rapid synaptic plasticity within the hippocampus for their formation and are gradually consolidated in neocortical networks for permanent storage. However the engrams and circuits that support neocortical memory consolidation have thus far been unknown. We found that neocortical prefrontal memory engram cells which are critical for remote contextual fear memory were rapidly generated during initial learning through inputs from both the hippocampal-entorhinal cortex network and the basolateral amygdala. After their generation the prefrontal engram cells with support from  hippocampal memory engram cells became functionally mature with time. Whereas hippocampal engram cells gradually became silent with time engram cells in the basolateral amygdala which were necessary for fear memory were maintained. Our  data provide new insights into the functional reorganization of engrams and circuits underlying systems consolidation of memory.,10.1126/science.aam6808
0,,10.1523/jneurosci.0365-09.2009
0,,10.1016/0006-8993(94)91229-7
0,The nigrostriatal dopamine (DA) system is sexually dimorphic. In female but not male rats striatal DA activity is modulated by gonadal steroid hormones. Ovariectomy (OVX) decreases striatal DA release and turnover. Estrogen replacement restores the response to that of the intact female in estrus. In contrast castration (CAST) of male rats has no effect on the stimulated release  of DA from striatal tissue. This report addresses the question: Does estrogen act directly on the striatum to induce changes in DA release? Physiological concentrations of 17 beta-estradiol and other steroids or a nonsteroidal estrogen analog were applied directly to striatal tissue maintained in an in vitro superfusion system. The effect of hormonal treatments on the responsiveness of striatal DA terminals to stimulation was examined in tissue from OVX females and  intact and CAST male rats. The results are summarized as follows: (1) Infusion of 17 beta-estradiol (p less than 0.01) and diethylstilbestrol (p less than 0.05) increased amphetamine (AMPH)-stimulated striatal DA release from striatal tissue  of OVX female rats compared with the effect of cholesterol. 17 alpha-Estradiol also tended to potentiate the striatal DA response to AMPH but this result was not statistically significant (p less than 0.062). 17 beta-Estradiol had no effect on AMPH-stimulated DA release from striatal tissue of intact male rats. (2) The KCl-stimulated release of DA from striatal tissue of OVX rats exposed in  vitro to 100 pg/ml 17 beta-estradiol (a physiological dose) was significantly greater (p less than 0.05) than the response after exposure to vehicle.(ABSTRACT  TRUNCATED AT 250 WORDS),10.1002/syn.890050211
0,,10.1038/547162e
