,abstract,doi
0,Neuroprosthesis research aims to enable communication between the brain and external assistive devices while restoring lost functionality such as occurs from stroke spinal cord injury or neurodegenerative diseases. In future closed-loop sensorimotor prostheses one approach is to use neuromodulation as direct stimulus to the brain to compensate for a lost sensory function and help the brain to integrate relevant information for commanding external devices via e.g. movement intention. Current neuromodulation techniques rely mainly of electrical  stimulation. Here we focus specifically on the question of eliciting a biomimetically relevant sense of touch by direct stimulus of the somatosensory cortex by introducing optogenetic techniques as an alternative to electrical stimulation. We demonstrate that light activated opsins can be introduced to target neurons in the somatosensory cortex of non-human primates and be optically activated to create a reliably detected sensation which the animal learns to interpret as a tactile sensation localized within the hand. The accomplishment highlighted here shows how optical stimulation of a relatively small group of mostly excitatory somatosensory neurons in the nonhuman primate brain is sufficient for eliciting a useful sensation from data acquired by simultaneous electrophysiology and from behavioral metrics. In this first report to date on optically neuromodulated behavior in the somatosensory cortex of nonhuman primates we do not yet dissect the details of the sensation the animals exerience or contrast it to those evoked by electrical stimulation issues of considerable  future interest.,10.1371/journal.pone.0114529
0,Brain recordings in large animal models and humans typically rely on a tethered connection which has restricted the spectrum of accessible experimental and clinical applications. To overcome this limitation we have engineered a compact lightweight high data rate wireless neurosensor capable of recording the full spectrum of electrophysiological signals from the cortex of mobile subjects. The  wireless communication system exploits a spatially distributed network of synchronized receivers that is scalable to hundreds of channels and vast environments. To demonstrate the versatility of our wireless neurosensor we monitored cortical neuron populations in freely behaving nonhuman primates during natural locomotion and sleep-wake transitions in ecologically equivalent settings. The interface is electrically safe and compatible with the majority of  existing neural probes which may support previously inaccessible experimental and clinical research.,10.1016/j.neuron.2014.11.010
0,Transient gamma-band (40-80 Hz) spatiotemporal patterns are hypothesized to play  important roles in cortical function. Here we report the direct observation of gamma oscillations as spatiotemporal waves induced by targeted optogenetic stimulation recorded by intracortical multichannel extracellular techniques in macaque monkeys during their awake resting states. Microelectrode arrays integrating an optical fiber at their center were chronically implanted in primary motor (M1) and ventral premotor (PMv) cortices of two subjects. Targeted  brain tissue was transduced with the red-shifted opsin C1V1(T/T). Constant (1-s square pulses) and ramp stimulation induced narrowband gamma oscillations during  awake resting states. Recordings across 95 microelectrodes (4 × 4-mm array) enabled us to track the transient gamma spatiotemporal patterns manifested e.g. as concentric expanding and spiral waves. Gamma oscillations were induced well beyond the light stimulation volume via network interactions at distal electrode sites depending on optical power. Despite stimulation-related modulation in spiking rates neuronal spiking remained highly asynchronous during induced gamma oscillations. In one subject we examined stimulation effects during preparation and execution of a motor task and observed that movement execution largely attenuated optically induced gamma oscillations. Our findings demonstrate that beyond previously reported induced gamma activity under periodic drive a prolonged constant stimulus above a certain threshold may carry primate motor cortex network dynamics into gamma oscillations likely via a Hopf bifurcation. More broadly the experimental capability in combining microelectrode array recordings and optogenetic stimulation provides an important approach for probing spatiotemporal dynamics in primate cortical networks during various physiological and behavioral conditions.,10.1152/jn.00792.2014
0,Transitions into primary generalized epileptic seizures occur abruptly and synchronously across the brain. Their potential triggers remain unknown. We used  optogenetics to causally test the hypothesis that rhythmic population bursting of excitatory neurons in a local neocortical region can rapidly trigger absence seizures. Most previous studies have been purely correlational and it remains unclear whether epileptiform events induced by rhythmic stimulation (e.g. sensory/electrical) mimic actual spontaneous seizures especially regarding their spatiotemporal dynamics. In this study we used a novel combination of intracortical optogenetic stimulation and microelectrode array recordings in freely moving WAG/Rij rats a model of absence epilepsy with a cortical focus in  the somatosensory cortex (SI). We report three main findings: 1) Brief rhythmic bursting evoked by optical stimulation of neocortical excitatory neurons at frequencies around 10 Hz induced seizures consisting of self-sustained spike-wave discharges (SWDs) for about 10% of stimulation trials. The probability of inducing seizures was frequency-dependent reaching a maximum at 10 Hz. 2) Local field potential power before stimulation and response amplitudes during stimulation both predicted seizure induction demonstrating a modulatory effect of brain states and neural excitation levels. 3) Evoked responses during stimulation propagated as cortical waves likely reaching the cortical focus which in turn generated self-sustained SWDs after stimulation was terminated. Importantly SWDs during induced and spontaneous seizures propagated with the same spatiotemporal dynamics. Our findings demonstrate that local rhythmic bursting of excitatory neurons in neocortex at particular frequencies under susceptible ongoing brain states is sufficient to trigger primary generalized seizures with stereotypical spatiotemporal dynamics.,10.1152/jn.01040.2014
0,DOI: 10.1109/TCBB.2015.2462370  PMID: 27295638  [Indexed for MEDLINE],10.1109/ner.2013.6696102
0,Optogenetics the selective excitation or inhibition of neural circuits by light has become a transformative approach for dissecting functional brain microcircuits particularly in in vivo rodent models owing to the expanding libraries of opsins and promoters. Yet there is a lack of versatile devices that  can deliver spatiotemporally patterned light while performing simultaneous sensing to map the dynamics of perturbed neural populations at the network level. We have created optoelectronic actuator and sensor microarrays that can be used as monolithic intracortical implants fabricated from an optically transparent electrically highly conducting semiconductor ZnO crystal. The devices can perform simultaneous light delivery and electrical readout in precise spatial registry across the microprobe array. We applied the device technology in transgenic mice  to study light-perturbed cortical microcircuit dynamics and their effects on behavior. The functionality of this device can be further expanded to optical imaging and patterned electrical microstimulation.,10.1038/nmeth.3620
0,Luminopsins are fusion proteins of luciferase and opsin that allow interrogation  of neuronal circuits at different temporal and spatial resolutions by choosing either extrinsic physical or intrinsic biological light for its activation. Building on previous development of fusions of wild-type Gaussia luciferase with  channelrhodopsin here we expanded the utility of luminopsins by fusing bright Gaussia luciferase variants with either channelrhodopsin to excite neurons (luminescent opsin LMO) or a proton pump to inhibit neurons (inhibitory LMO iLMO). These improved LMOs could reliably activate or silence neurons in vitro and in vivo. Expression of the improved LMO in hippocampal circuits not only enabled mapping of synaptic activation of CA1 neurons with fine spatiotemporal resolution but also could drive rhythmic circuit excitation over a large spatiotemporal scale. Furthermore virus-mediated expression of either LMO or iLMO in the substantia nigra in vivo produced not only the expected bidirectional control of single unit activity but also opposing effects on circling behavior in response to systemic injection of a luciferase substrate. Thus although preserving the ability to be activated by external light sources LMOs expand the use of optogenetics by making the same opsins accessible to noninvasive chemogenetic control thereby allowing the same probe to manipulate neuronal activity over a range of spatial and temporal scales.,10.1073/pnas.1510899113
0,,10.1523/jneurosci.3474-11.2012
0,Response modulation by prior sensory stimulation is a common property of cortical neurons. The degree to which effects are specific to the adapting stimulus provides insights into properties of the underlying circuitry. Here we examined  the effects of an adapting whisker deflection's angle on the angular tuning of layer IV barrel neurons and their major input source thalamic barreloid neurons. In both barrel regular-spike units (RSUs) and fast-spike units (FSUs) presumed excitatory and inhibitory neurons prior whisker deflections suppressed subsequent test deflections in a largely angularly nonspecific manner that is adaptation in one direction reduced responses for test deflections of all angles. FSUs were poorly tuned for deflection angle and remained so after adaptation. In  adapted RSUs responses to suboptimal directions were suppressed most and angular preferences remained constant; tuning therefore became sharper. Adaptation effects in RSUs and FSUs do not appear to reflect corresponding changes in thalamic neurons. The angularly nonspecific suppression of barrel neurons is likely mediated by local intrabarrel suppressive interactions such as broadly tuned inhibition and/or short-term synaptic depression of excitatory connections. The dominance of angularly nonspecific suppression suggests that barrel neurons interact largely in an angularly nonspecific manner to reinforce stimulus preferences encoded by their synchronously firing thalamic inputs.,10.1093/cercor/bhk006
0,Full understanding of the functional complexity of the protein interactome requires mapping of biomolecular complexes within the cellular environment over biologically relevant time scales. New approaches to imaging interacting protein  partners in vivo will allow the study of functional proteomics of human biology and disease within the context of living animals. Herein we describe a universal transgenic reporter mouse strain that expresses firefly luciferase (Fluc) under the regulatory control of a concatenated Gal4 promoter (Tg(G4F(+/-))). Using an adenovirus to deliver a fused binding-domain-activator chimera (Gal4BD-VP16) induction of bioluminescence in Tg(G4F(+/-)) tissues of up to 4 orders of magnitude was observed in fibroblasts liver respiratory epithelia muscle and  brain. The Tg(G4F(+/-)) reporter strain allowed noninvasive detection of viral infectivity duration of the infection as well as viral clearance in various tissues in vivo. To demonstrate protein-protein interactions in live mice the well characterized interaction between tumor suppressor p53 (fused to Gal4BD) and large T antigen (TAg) (fused to VP16) was visualized in vivo by using a two-hybrid strategy. Hepatocytes of Tg(G4F(+/-)) mice transfected with p53/TAg demonstrated 48-fold greater induction of Fluc expression in vivo than noninteracting pairs. Furthermore to demonstrate the feasibility of monitoring experimental therapy with siRNA in vivo targeted knockdown of p53 resulted in markedly reduced light output whereas use of a control siRNA had no effect on protein interaction-dependent induction of Fluc. Thus this highly inducible Gal4-->Fluc conditional reporter strain should facilitate imaging studies of protein interactions signaling cascades viral dissemination and therapy within the physiological context of the whole animal.,10.1073/pnas.0801075105
0,,10.1523/jneurosci.1592-13.2013
0,Because it lacks a lymphatic circulation the brain must clear extracellular proteins by an alternative mechanism. The cerebrospinal fluid (CSF) functions as  a sink for brain extracellular solutes but it is not clear how solutes from the  brain interstitium move from the parenchyma to the CSF. We demonstrate that a substantial portion of subarachnoid CSF cycles through the brain interstitial space. On the basis of in vivo two-photon imaging of small fluorescent tracers we showed that CSF enters the parenchyma along paravascular spaces that surround  penetrating arteries and that brain interstitial fluid is cleared along paravenous drainage pathways. Animals lacking the water channel aquaporin-4 (AQP4) in astrocytes exhibit slowed CSF influx through this system and a ~70% reduction in interstitial solute clearance suggesting that the bulk fluid flow between these anatomical influx and efflux routes is supported by astrocytic water transport. Fluorescent-tagged amyloid β a peptide thought to be pathogenic in Alzheimer's disease was transported along this route and deletion of the Aqp4 gene suppressed the clearance of soluble amyloid β suggesting that this pathway may remove amyloid β from the central nervous system. Clearance through paravenous flow may also regulate extracellular levels of proteins involved with  neurodegenerative conditions its impairment perhaps contributing to the mis-accumulation of soluble proteins.,10.1126/scitranslmed.3003748
0,Living organisms produce hydrogen peroxide (H(2)O(2)) to kill invading pathogens  and for cellular signaling but aberrant generation of this reactive oxygen species is a hallmark of oxidative stress and inflammation in aging injury and  disease. The effects of H(2)O(2) on the overall health of living animals remain elusive in part owing to a dearth of methods for studying this transient small molecule in vivo. Here we report the design synthesis and in vivo applications  of Peroxy Caged Luciferin-1 (PCL-1) a chemoselective bioluminescent probe for the real-time detection of H(2)O(2) within living animals. PCL-1 is a boronic acid-caged firefly luciferin molecule that selectively reacts with H(2)O(2) to release firefly luciferin which triggers a bioluminescent response in the presence of firefly luciferase. The high sensitivity and selectivity of PCL-1 for H(2)O(2) combined with the favorable properties of bioluminescence for in vivo imaging afford a unique technology for real-time detection of basal levels of H(2)O(2) generated in healthy living mice. Moreover we demonstrate the efficacy of PCL-1 for monitoring physiological fluctuations in H(2)O(2) levels by directly imaging elevations in H(2)O(2) within testosterone-stimulated tumor xenografts in vivo. The ability to chemoselectively monitor H(2)O(2) fluxes in real time in living animals offers opportunities to dissect H(2)O(2)'s disparate contributions to health aging and disease.,10.1073/pnas.1012864107
0,Visual attention can improve behavioral performance by allowing observers to focus on the important information in a complex scene. Attention also typically increases the firing rates of cortical sensory neurons. Rate increases improve the signal-to-noise ratio of individual neurons and this improvement has been assumed to underlie attention-related improvements in behavior. We recorded dozens of neurons simultaneously in visual area V4 and found that changes in single neurons accounted for only a small fraction of the improvement in the sensitivity of the population. Instead over 80% of the attentional improvement in the population signal was caused by decreases in the correlations between the  trial-to-trial fluctuations in the responses of pairs of neurons. These results suggest that the representation of sensory information in populations of neurons  and the way attention affects the sensitivity of the population may only be understood by considering the interactions between neurons.,10.1038/nn.2439
0,Predictions about future rewarding events have a powerful influence on behaviour. The phasic spike activity of dopamine-containing neurons and corresponding dopamine transients in the striatum are thought to underlie these predictions encoding positive and negative reward prediction errors. However many behaviours are directed towards distant goals for which transient signals may fail to provide sustained drive. Here we report an extended mode of reward-predictive dopamine signalling in the striatum that emerged as rats moved towards distant goals. These dopamine signals which were detected with fast-scan cyclic voltammetry (FSCV) gradually increased or--in rare instances--decreased as the animals navigated mazes to reach remote rewards rather than having phasic or steady tonic profiles. These dopamine increases (ramps) scaled flexibly with both the distance and size of the rewards. During learning these dopamine signals showed spatial preferences for goals in different locations and readily changed in magnitude to reflect changing values of the distant rewards. Such prolonged dopamine signalling could provide sustained motivational drive a control mechanism that may be important for normal behaviour and that can be impaired in  a range of neurologic and neuropsychiatric disorders.,10.1038/nature12475
0,Dopamine cell firing can encode errors in reward prediction providing a learning signal to guide future behavior. Yet dopamine is also a key modulator of motivation invigorating current behavior. Existing theories propose that fast (phasic) dopamine fluctuations support learning whereas much slower (tonic) dopamine changes are involved in motivation. We examined dopamine release in the  nucleus accumbens across multiple time scales using complementary microdialysis  and voltammetric methods during adaptive decision-making. We found that minute-by-minute dopamine levels covaried with reward rate and motivational vigor. Second-by-second dopamine release encoded an estimate of temporally discounted future reward (a value function). Changing dopamine immediately altered willingness to work and reinforced preceding action choices by encoding temporal-difference reward prediction errors. Our results indicate that dopamine  conveys a single rapidly evolving decision variable the available reward for investment of effort which is employed for both learning and motivational functions.,10.1038/nn.4173
0,Manipulation of neuronal activity through genetically targeted actuator molecules is a powerful approach for studying information flow in the brain. In these approaches the genetically targeted component a receptor or a channel is activated either by a small molecule (chemical genetics) or by light from a physical source (optogenetics). We developed a hybrid technology that allows control of the same neurons by both optogenetic and chemical genetic means. The approach is based on engineered chimeric fusions of a light-generating protein (luciferase) to a light-activated ion channel (channelrhodopsin). Ionic currents  then can be activated by bioluminescence upon activation of luciferase by its substrate coelenterazine (CTZ) as well as by external light. In cell lines expression of the fusion of Gaussia luciferase to Channelrhodopsin-2 yielded photocurrents in response to CTZ. Larger photocurrents were produced by fusing the luciferase to Volvox Channelrhodopsin-1. This version allowed chemical modulation of neuronal activity when expressed in cultured neurons: CTZ treatment shifted neuronal responses to injected currents and sensitized neurons to fire action potentials in response to subthreshold synaptic inputs. These luminescent  channelrhodopsins--or luminopsins--preserve the advantages of light-activated ion channels while extending their capabilities. Our proof-of-principle results suggest that this novel class of tools can be improved and extended in numerous ways.,10.1371/journal.pone.0059759
0,"Attention can be focused volitionally by ""top-down"" signals derived from task demands and automatically by ""bottom-up"" signals from salient stimuli. The frontal and parietal cortices are involved but their neural activity has not been directly compared. Therefore we recorded from them simultaneously in monkeys. Prefrontal neurons reflected the target location first during top-down attention whereas parietal neurons signaled it earlier during bottom-up attention. Synchrony between frontal and parietal areas was stronger in lower frequencies during top-down attention and in higher frequencies during bottom-up  attention. This result indicates that top-down and bottom-up signals arise from the frontal and sensory cortex respectively and different modes of attention may emphasize synchrony at different frequencies.",10.1126/science.1138071
0,Optogenetic techniques provide an unprecedented ability to precisely manipulate neural activity in the context of complex neural circuitry. Although the toolbox  of optogenetic probes continues to expand at a rapid pace with more efficient and responsive reagents hardware-based light delivery is still a major hurdle that limits its practical use in vivo. We have bypassed the challenges of external light delivery by directly coupling a bioluminescent light source (a genetically  encoded luciferase) to an inhibitory opsin which we term an inhibitory luminopsin (iLMO). iLMO was shown to suppress action potential firing and synchronous bursting activity in vitro in response to both external light and luciferase substrate. iLMO was further shown to suppress single-unit firing rate  and local field potentials in the hippocampus of anesthetized rats. Finally expression of iLMO was scaled up to multiple structures of the basal ganglia to modulate rotational behavior of freely moving animals in a hardware-independent fashion. This novel class of optogenetic probes demonstrates how non-invasive inhibition of neural activity can be achieved which adds to the versatility scalability and practicality of optogenetic applications in freely behaving animals.,10.1038/srep14366
0,Most mammals possess high-resolution visual perception with primary visual cortices containing fine-scale inter-related feature representations (for example orientation and ocular dominance). Rats lack precise vision but their vibrissa sensory system provides a precise tactile modality including vibrissa-related 'barrel' columns in primary somatosensory cortex. Here we examined the subcolumnar organization of direction preference and somatotopy using a new omni-directional multi-vibrissa stimulator. We discovered a direction map that was systematically linked to somatotopy such that neurons were tuned for motion toward their preferred surround vibrissa. This sub-barrel column direction map demonstrated an emergent refinement from layer IV to layer II/III. These data suggest that joint processing of multiple sensory features is  a common property of high-resolution sensory systems.,10.1038/nn1671
0,,10.1146/annurev.bioeng.9.060906.151840
0,DOI: 10.1109/EMBC.2015.7318942  PMID: 26736842 ,10.1109/embc.2015.7318942
0,DOI: 10.1109/TCBB.2015.2462370  PMID: 27295638  [Indexed for MEDLINE],10.1109/memsys.2015.7051049
0,When pressure is applied to a localized area of the body for an extended time the resulting loss of blood flow and subsequent reperfusion to the tissue causes  cell death and a pressure ulcer develops. Preventing pressure ulcers is challenging because the combination of pressure and time that results in tissue damage varies widely between patients and the underlying damage is often severe  by the time a surface wound becomes visible. Currently no method exists to detect early tissue damage and enable intervention. Here we demonstrate a flexible electronic device that non-invasively maps pressure-induced tissue damage even when such damage cannot be visually observed. Using impedance spectroscopy across flexible electrode arrays in vivo on a rat model we find that impedance is robustly correlated with tissue health across multiple animals  and wound types. Our results demonstrate the feasibility of an automated non-invasive 'smart bandage' for early detection of pressure ulcers.,10.1038/ncomms7575
0,DOI: 10.1109/EMBC.2014.6944161  PMID: 25570529  [Indexed for MEDLINE],10.1109/embc.2014.6944161
0,DOI: 10.1109/TCBB.2015.2462370  PMID: 27295638  [Indexed for MEDLINE],10.1109/embsisc.2016.7508602
