,abstract,doi
0,Brain vasculature is a complex and interconnected network under tight regulatory  control that exists in intimate communication with neurons and glia. Typically hemodynamics are considered to exclusively serve as a metabolic support system. In contrast to this canonical view we propose that hemodynamics also play a role in information processing through modulation of neural activity. Functional hyperemia the basis of the functional MRI (fMRI) BOLD signal is a localized influx of blood correlated with neural activity levels. Functional hyperemia is considered by many to be excessive from a metabolic standpoint but may be appropriate if interpreted as having an activity-dependent neuro-modulatory function. Hemodynamics may impact neural activity through direct and indirect mechanisms. Direct mechanisms include delivery of diffusible blood-borne messengers and mechanical and thermal modulation of neural activity. Indirect mechanisms are proposed to act through hemodynamic modulation of astrocytes which can in turn regulate neural activity. These hemo-neural mechanisms should alter the information processing capacity of active local neural networks. Here  we focus on analysis of neocortical sensory processing. We predict that hemodynamics alter the gain of local cortical circuits modulating the detection  and discrimination of sensory stimuli. This novel view of information processing-that includes hemodynamics as an active and significant participant-has implications for understanding neural representation and the construction of accurate brain models. There are also potential medical benefits  of an improved understanding of the role of hemodynamics in neural processing as it directly bears on interpretation of and potential treatment for stroke dementia and epilepsy.,10.1152/jn.01366.2006
0,"Frontal neocortex is thought to support our highest intellectual abilities including our ability to plan and enact a sequence of tasks toward a desired goal. In everyday life such task sequences are abstract in that they do not require consistent movement sequences and are often assembled ""on the fly."" Yet  remarkably little is known about the necessity of frontal sub-regions for such control. Participants repeatedly completed sequences of simple tasks during fMRI  scanning. Rostrolateral prefrontal cortex (RLPFC) activation ramped over sequence position and reset at the initiation of each new sequence. To establish the necessity and function of RLPFC in this task participants performed the sequential task while undergoing transcranial magnetic stimulation (TMS) of the RLPFC versus two prefrontal control regions. Across two independent experiments  only RLPFC stimulation increasingly disrupted task performance as each sequence progressed. These data establish RLPFC as necessary for uncertainty resolution during sequence-level control.",10.1016/j.neuron.2015.08.026
0,Synchronous recruitment of fast-spiking (FS) parvalbumin (PV) interneurons generates gamma oscillations rhythms that emerge during performance of cognitive tasks. Administration of N-methyl-D-aspartate (NMDA) receptor antagonists alters  gamma rhythms and can induce cognitive as well as psychosis-like symptoms in humans. The disruption of NMDA receptor (NMDAR) signaling specifically in FS PV interneurons is therefore hypothesized to give rise to neural network dysfunction that could underlie these symptoms. To address the connection between NMDAR activity FS PV interneurons gamma oscillations and behavior we generated mice  lacking NMDAR neurotransmission only in PV cells (PV-Cre/NR1f/f mice). Here we show that mutant mice exhibit enhanced baseline cortical gamma rhythms impaired  gamma rhythm induction after optogenetic drive of PV interneurons and reduced sensitivity to the effects of NMDAR antagonists on gamma oscillations and stereotypies. Mutant mice show largely normal behaviors except for selective cognitive impairments including deficits in habituation working memory and associative learning. Our results provide evidence for the critical role of NMDAR in PV interneurons for expression of normal gamma rhythms and specific cognitive  behaviors.,10.1038/mp.2011.31
0,Two general classes of hypotheses for the role for gamma oscillations in sensation are those that predict gamma facilitates signal amplification through local synchronization of a distinct ensemble and those that predict gamma modulates fine temporal relationships between neurons to represent information. Correlative evidence has been offered for and against these hypotheses. A recent  study in which gamma was optogenetically entrained by driving fast-spiking interneurons showed enhanced sensory detection of harder-to-perceive stimuli those that benefit most from attention in agreement with the amplification hypotheses. These findings are supported by similar studies employing less specific optogenetic patterns or single neuron stimulation but contrast with findings based on direct optogenetic stimulation of pyramidal neurons. Key next steps for this topic are described.,10.1016/j.conb.2015.02.004
0,Many procedures in modern clinical medicine rely on the use of electronic implants in treating conditions that range from acute coronary events to traumatic injury. However standard permanent electronic hardware acts as a nidus for infection: bacteria form biofilms along percutaneous wires or seed haematogenously with the potential to migrate within the body and to provoke immune-mediated pathological tissue reactions. The associated surgical retrieval  procedures meanwhile subject patients to the distress associated with re-operation and expose them to additional complications. Here we report materials device architectures integration strategies and in vivo demonstrations in rats of implantable multifunctional silicon sensors for the brain for which all of the constituent materials naturally resorb via hydrolysis and/or metabolic action eliminating the need for extraction. Continuous monitoring of intracranial pressure and temperature illustrates functionality essential to the treatment of traumatic brain injury; the measurement performance of our resorbable devices compares favourably with that of non-resorbable clinical standards. In our experiments insulated percutaneous wires connect to an externally mounted miniaturized wireless potentiostat for data transmission.  In a separate set-up we connect a sensor to an implanted (but only partially resorbable) data-communication system proving the principle that there is no need for any percutaneous wiring. The devices can be adapted to sense fluid flow motion pH or thermal characteristics in formats that are compatible with the body's abdomen and extremities as well as the deep brain suggesting that the sensors might meet many needs in clinical medicine.,10.1038/nature16492
0,Several studies in patients with schizophrenia reported a marked reduction in sleep spindle activity. To investigate whether the reduction may be linked to genetic risk of the illness we analysed sleep spindle activity in healthy volunteers patients with schizophrenia and first-degree relatives who share an  enriched set of schizophrenia susceptibility genes. We further investigated the correlation of spindle activity with cognitive function in first-degree relatives and whether spindle abnormalities affect both fast (12-15 Hz) and slow (9-12 Hz)  sleep spindles. We investigated fast and slow sleep spindle activity during non-rapid eye movement sleep in a total of 47 subjects comprising 17 patients with schizophrenia 13 healthy first-degree relatives and 17 healthy volunteers.  Groups were balanced for age gender years of education and estimated verbal IQ. A subsample of relatives received additional testing for memory performance. Compared to healthy volunteers fast spindle density was reduced in patients with schizophrenia and healthy first-degree relatives following a pattern consistent with an assumed genetic load for schizophrenia. The deficit in spindle density was specific to fast spindles and was associated with decreased memory performance. Our findings indicate familial occurrence of this phenotype and thus support the hypothesis that deficient spindle activity relates to genetic liability for schizophrenia. Furthermore spindle reductions predict impaired cognitive function and are specific to fast spindles. This physiological marker should be further investigated as an intermediate phenotype of schizophrenia. It  could also constitute a target for drug development especially with regard to cognitive dysfunction.,10.1007/s00406-016-0725-2
0,Corticothalamic neurons provide massive input to the thalamus. This top-down projection may allow the cortex to regulate sensory processing by modulating the  excitability of thalamic cells. Layer 6 corticothalamic neurons monosynaptically  excite thalamocortical cells but also indirectly inhibit them by driving inhibitory cells of the thalamic reticular nucleus. Whether corticothalamic activity generally suppresses or excites the thalamus remains unclear. Here we show that the corticothalamic influence is dynamic with the excitatory-inhibitory balance shifting in an activity-dependent fashion. During low-frequency activity corticothalamic effects are mainly suppressive whereas higher-frequency activity (even a short bout of gamma frequency oscillations) converts the corticothalamic influence to enhancement. The mechanism of this switching depends on distinct forms of short-term synaptic plasticity across multiple corticothalamic circuit components. Our results reveal an activity-dependent mechanism by which corticothalamic neurons can bidirectionally switch the excitability and sensory throughput of the thalamus possibly to meet  changing behavioral demands.,10.1016/j.neuron.2015.03.040
0,Sensory regions of the brain integrate environmental cues with copies of motor-related signals important for imminent and ongoing movements. In mammals signals propagating from the motor cortex to the auditory cortex are thought to have a critical role in normal hearing and behaviour yet the synaptic and circuit mechanisms by which these motor-related signals influence auditory cortical activity remain poorly understood. Using in vivo intracellular recordings in behaving mice we find that excitatory neurons in the auditory cortex are suppressed before and during movement owing in part to increased activity of local parvalbumin-positive interneurons. Electrophysiology and optogenetic gain- and loss-of-function experiments reveal that motor-related changes in auditory cortical dynamics are driven by a subset of neurons in the secondary motor cortex that innervate the auditory cortex and are active during movement. These findings provide a synaptic and circuit basis for the motor-related corollary discharge hypothesized to facilitate hearing and auditory-guided behaviours.,10.1038/nature13724
0,Over a century of scientific work has focused on defining the factors motivating  behavioral learning. Observations in animals and humans trained on a wide range of tasks support reinforcement learning (RL) algorithms as accounting for the learning. Still unknown however are the signals that drive learning in naive untrained subjects. Here we capitalized on a sequential saccade task in which macaque monkeys acquired repetitive scanning sequences without instruction. We found that spike activity in the caudate nucleus after each trial corresponded to an integrated cost-benefit signal that was highly correlated with the degree of naturalistic untutored learning by the monkeys. Across learning neurons encoding both cost and outcome gradually acquired increasingly sharp phasic trial-end responses that paralleled the development of the habit-like repetitive saccade sequences. Our findings demonstrate an integrated cost-benefit signal by which RL and its neural correlates could drive naturalistic behaviors in freely behaving primates.,10.1016/j.neuron.2015.07.019
0,Most aquatic vertebrates use suction to capture food relying on rapid expansion  of the mouth cavity to accelerate water and food into the mouth. In ray-finned fishes mouth expansion is both fast and forceful and therefore requires considerable power. However the cranial muscles of these fishes are relatively small and may not be able to produce enough power for suction expansion. The axial swimming muscles of these fishes also attach to the feeding apparatus and have the potential to generate mouth expansion. Because of their large size these axial muscles could contribute substantial power to suction feeding. To determine whether suction feeding is powered primarily by axial muscles we measured the power required for suction expansion in largemouth bass and compared it to the power capacities of the axial and cranial muscles. Using X-ray reconstruction of moving morphology (XROMM) we generated 3D animations of the mouth skeleton and created a dynamic digital endocast to measure the rate of mouth volume expansion. This time-resolved expansion rate was combined with intraoral pressure recordings to calculate the instantaneous power required for suction feeding. Peak expansion powers for all but the weakest strikes far exceeded the maximum power capacity of the cranial muscles. The axial muscles did not merely contribute but were the primary source of suction expansion power and  generated up to 95% of peak expansion power. The recruitment of axial muscle power may have been crucial for the evolution of high-power suction feeding in ray-finned fishes.,10.1073/pnas.1508055112
0,Marker-based XROMM requires software tools for: (1) correcting fluoroscope distortion; (2) calibrating X-ray cameras; (3) tracking radio-opaque markers; and (4) calculating rigid body motion. In this paper we describe and validate XMALab a new open-source software package for marker-based XROMM (C++ source and compiled versions on Bitbucket). Most marker-based XROMM studies to date have used XrayProject in MATLAB. XrayProject can produce results with excellent accuracy and precision but it is somewhat cumbersome to use and requires a MATLAB license. We have designed XMALab to accelerate the XROMM process and to make it more accessible to new users. Features include the four XROMM steps (listed above) in one cohesive user interface real-time plot windows for detecting errors and integration with an online data management system XMAPortal. Accuracy and precision of XMALab when tracking markers in a machined object are ±0.010 and ±0.043 mm respectively. Mean precision for nine users tracking markers in a tutorial dataset of minipig feeding was ±0.062 mm in XMALab and ±0.14 mm in XrayProject. Reproducibility of 3D point locations across nine users was 10-fold greater in XMALab than in XrayProject and six degree-of-freedom bone motions calculated with a joint coordinate system were 3-  to 6-fold more reproducible in XMALab. XMALab is also suitable for tracking white or black markers in standard light videos with optional checkerboard calibration. We expect XMALab to increase both the quality and quantity of animal motion data  available for comparative biomechanics research.,10.1242/jeb.145383
0,BACKGROUND: In the neurodevelopmental disorder autism several neuroimmune abnormalities have been reported. However it is unknown whether microglial somal volume or density are altered in the cortex and whether any alteration is associated with age or other potential covariates. METHODS: Microglia in sections from the dorsolateral prefrontal cortex of nonmacrencephalic male cases with autism (n = 13) and control cases (n = 9) were  visualized via ionized calcium binding adapter molecule 1 immunohistochemistry. In addition to a neuropathological assessment microglial cell density was stereologically estimated via optical fractionator and average somal volume was quantified via isotropic nucleator. RESULTS: Microglia appeared markedly activated in 5 of 13 cases with autism including 2 of 3 under age 6 and marginally activated in an additional 4 of 13 cases. Morphological alterations included somal enlargement process retraction and thickening and extension of filopodia from processes. Average microglial somal volume was significantly increased in white matter (p = .013) with a trend in gray matter (p = .098). Microglial cell density was increased in gray matter (p = .002). Seizure history did not influence any activation measure. CONCLUSIONS: The activation profile described represents a neuropathological alteration in a sizeable fraction of cases with autism. Given its early presence microglial activation may play a central role in the pathogenesis of autism in a  substantial proportion of patients. Alternatively activation may represent a response of the innate neuroimmune system to synaptic neuronal or neuronal network disturbances or reflect genetic and/or environmental abnormalities impacting multiple cellular populations.,10.1016/j.biopsych.2010.05.024
0,BACKGROUND: Besides the central role of the adaptive immune system a disturbance of innate immune system is also suggested to be involved in the pathogenesis of multiple sclerosis (MS). CD14 a receptor upregulated in activated microglia is  known to be an essential mediator of inflammation in innate immune responses. Therefore in this study we aimed to assess possible roles of CD14-159 and -260 gene polymorphisms in MS susceptibility and the effects of those polymorphisms to its protein producing capacity in Iranian population. METHODS: In this case control study CD14-159 and -260 polymorphisms were genotyped using polymerase chain reaction restriction fragment length polymorphism (PCR-RFLP) in 200 MS patients and 200 healthy controls matched in age and gender. Serum levels of soluble CD14 (sCD14) was determined by enzyme-linked immunosorbent assay (ELISA). RESULTS: There were significant differences in genotype distribution of CD14-159  and -260 polymorphisms between patients and controls (P = 0.01 for-both). Mean serum level of sCD14 was significantly higher in MS patients than in control subjects (3340.30 ± 612.50 ng/ml vs 2353.73 ± 539.07 ng/ml; P < 0.01). CONCLUSION: In summary we conclude that CD14-159 and -260 polymorphisms are associated with the risk of MS in Iranian population and affects CD14 promoter activity thereby regulating CD14 expression. Furthermore our study provides preliminary evidence for the activation of innate immunity in the pathogenesis of MS. In addition the findings of the present study suggest serum level of sCD14 as candidate biomarker of MS severity.,10.1080/08820139.2016.1226897
0,"The retina reports the visual scene to the brain through many parallel channels  each carried by a distinct population of retinal ganglion cells. Among these the population with the smallest and densest receptive fields encodes the neural image with highest resolution. In human retina and those of cat and macaque these high-resolution ganglion cells act as generic pixel encoders: They serve to represent many different visual inputs and convey a neural image of the scene downstream for further processing. Here we identify and analyze high-resolution ganglion cells in the mouse retina using a transgenic line in which these cells called ""W3"" are labeled fluorescently. Counter to the expectation these ganglion cells do not participate in encoding generic visual scenes but remain silent during most common visual stimuli. A detailed study of their response properties showed that W3 cells pool rectified excitation from both On and Off bipolar cells which makes them sensitive to local motion. However they also receive unusually strong lateral inhibition both pre- and postsynaptically triggered by distant motion. As a result the W3 cell can detect small moving objects down to the receptive field size of bipolar cells but only if the background is featureless or stationary--an unusual condition. A survey of naturalistic stimuli shows that W3 cells may serve as alarm neurons for overhead  predators.",10.1073/pnas.1211547109
0,As the tissue macrophages of the CNS microglia are critically involved in diseases of the CNS. However it remains unknown what controls their maturation and activation under homeostatic conditions. We observed substantial contributions of the host microbiota to microglia homeostasis as germ-free (GF)  mice displayed global defects in microglia with altered cell proportions and an immature phenotype leading to impaired innate immune responses. Temporal eradication of host microbiota severely changed microglia properties. Limited microbiota complexity also resulted in defective microglia. In contrast recolonization with a complex microbiota partially restored microglia features. We determined that short-chain fatty acids (SCFA) microbiota-derived bacterial fermentation products regulated microglia homeostasis. Accordingly mice deficient for the SCFA receptor FFAR2 mirrored microglia defects found under GF conditions. These findings suggest that host bacteria vitally regulate microglia  maturation and function whereas microglia impairment can be rectified to some extent by complex microbiota.,10.1038/nn.4030
0,The mammalian AII retinal amacrine cell is a narrow-field multistratified glycinergic neuron best known for its role in collecting scotopic signals from rod bipolar cells and distributing them to ON and OFF cone pathways in a crossover network via a combination of inhibitory synapses and heterocellular AII::ON cone bipolar cell gap junctions. Long considered a simple cell a full connectomics analysis shows that AII cells possess the most complex interaction repertoire of any known vertebrate neuron contacting at least 28 different cell  classes including every class of retinal bipolar cell. Beyond its basic role in  distributing rod signals to cone pathways the AII cell may also mediate narrow-field feedback and feedforward inhibition for the photopic OFF channel photopic ON-OFF inhibitory crossover signaling and serves as a nexus for a collection of inhibitory networks arising from cone pathways that likely negotiate fast switching between cone and rod vision. Further analysis of the complete synaptic counts for five AII cells shows that (1) synaptic sampling is normalized for anatomic target encounter rates; (2) qualitative targeting is specific and apparently errorless; and (3) that AII cells strongly differentiate  partner cohorts by synaptic and/or coupling weights. The AII network is a dense hub connecting all primary retinal excitatory channels via precisely weighted drive and specific polarities. Homologs of AII amacrine cells have yet to be identified in non-mammalians but we propose that such homologs should be narrow-field glycinergic amacrine cells driving photopic ON-OFF crossover via heterocellular coupling with ON cone bipolar cells and glycinergic synapses on OFF cone bipolar cells. The specific evolutionary event creating the mammalian AII scotopic-photopic hub would then simply be the emergence of large numbers of  pure rod bipolar cells.,10.3389/fncir.2014.00104
0,,10.1093/jnen/59.7.561
0,"Synaptic plasticity is critical for elaboration and adaptation in the developing  and developed brain. It is well established that astrocytes play an important role in the maintenance of what has been dubbed ""the tripartite synapse"". Increasing evidence shows that a fourth cell type microglia is critical to this maintenance as well. Microglia are the resident macrophages of the central nervous system (CNS). Because of their well-characterized inflammatory functions research has primarily focused on their innate immune properties. The role of microglia in the maintenance of synapses in development and in homeostasis is not as well defined. A number of significant findings have shed light on the critical role of microglia at the synapse. It is becoming increasingly clear that microglia play a seminal role in proper synaptic development and elimination.",10.1155/2013/627325
0,Glutamatergic cytotoxicity mediated by overactivation of N-methyl-d-aspartate receptors (NMDARs) is implicated in numerous neurological disorders. To be therapeutically viable NMDAR antagonists must preserve physiological role of synaptic NMDARs (sNMDARs) in synaptic transmission and block only excessive pathological activation of NMDARs. Here we present a novel NMDAR antagonist that  satisfies this two-fold requirement by exploiting spatial differences in NMDAR subcellular locations. Specifically we designed a hybrid nanodrug (AuM) to be larger than the synaptic cleft by attaching memantine NMDAR antagonist via polymer linkers to a gold nanoparticle. We show that AuM efficiently and selectively inhibited extrasynaptic NMDARs (eNMDARs) while having no effect on sNMDARs and synaptic transmission. AuM exhibited neuroprotective properties both  in vitro and ex vivo during such neurotoxic insults as NMDAR-mediated cytotoxicity in cerebrocortical cell culture and oxygen-glucose deprivation in acute hippocampal slices. Furthermore AuM prevented dendritic spine loss triggered by Aβ oligomers in organotypic hippocampal slices and was more effective than free memantine. Using a novel rational design strategy we demonstrate a proof of concept for a new class of neuroprotective drugs that might be beneficial for treatment of several neurological disorders.,10.1021/acs.nanolett.6b01988
